{
  "schema_version": "2",
  "created_at": "2026-05-29T14:54:47",
  "model_hint": "gemini-3.1-flash-lite",
  "event": {
    "id": "2862",
    "name": "Tisková konference České pirátské strany",
    "classification": "Tiskové konference",
    "start_date": "2026-04-30T09:10",
    "end_date": "2026-04-30T09:22",
    "sources": [
      "final/event_2862_2026-04-30_tiskova-konference-ceske-piratske-strany.md"
    ]
  },
  "transcription": {
    "parts_transcribed": 1,
    "parts_total": 1,
    "source": "whisper",
    "model": "whisper-large-v3"
  },
  "summary": {
    "topic": "Tisková konference byla svolána zástupci České pirátské strany za účelem kritiky vládního postupu při projednávání novely stavebního zákona a zákona o podpoře bydlení. Piráti vyjádřili zásadní nesouhlas s podobou těchto legislativních návrhů, které považují za nekvalitní a ohrožující veřejný zájem.\n\nHlavním cílem vystoupení bylo upozornit na rizika spojená s novelou stavebního zákona, vyzvat k rezignaci či odvolání ministryně pro místní rozvoj Zuzany Mrázové a představit pirátské pozměňovací návrhy, které mají zajistit dostupnější bydlení a ochranu kvality života občanů.",
    "main_points": [
      "**Zdeněk Hřib (předseda Pirátů)** — Kritizoval novelu stavebního zákona jako „paskvil“ a „nezodpovědný experiment“. Uvedl, že až 70 % úředníků hrozí odchodem z profese. Vyzval k rezignaci ministryni Zuzanu Mrázovou, a to i v souvislosti s obviněním z existence její „černé stavby“.",
      "**Veronika Kovářová (poslankyně)** — Varovala, že novela stavebního zákona opomíjí veřejný zájem a staví soukromé podnikání na roveň ochraně zdraví obyvatel. Představila pozměňovací návrhy zaměřené na rychlejší výstavbu v dostupných lokalitách.",
      "**Olga Richtrová (předsedkyně klubu Pirátů)** — Zaměřila se na zákon o podpoře bydlení. Představila tři klíčové pozměňovací návrhy: zvýšení limitů pro vstup do systému podpory, úpravu výpočtu nákladů na bydlení dle reálných tržních cen a posílení role obcí a městských částí."
    ],
    "outcome": "Piráti deklarovali, že budou v rámci nadcházejících schůzí Poslanecké sněmovny aktivně prosazovat své pozměňovací návrhy k oběma zákonům. Zároveň hodlají nadále upozorňovat na kauzy ministryně Mrázové a kritizovat vládní návrhy v oblasti rozpočtové odpovědnosti.",
    "notes": "Přepis obsahuje místy nesrozumitelné pasáže, které jsou důsledkem chyb v automatickém přepisu. Kontext však zůstává srozumitelný."
  },
  "entities": {
    "speakers": [
      {
        "name": "Zdeněk Hřib",
        "person_id": "psp:person:6552",
        "affiliation": "Piráti"
      },
      {
        "name": "Veronika Kovářová",
        "person_id": "psp:person:7013",
        "affiliation": "Piráti"
      },
      {
        "name": "Olga Richtrová",
        "person_id": "psp:person:6473",
        "affiliation": "Piráti"
      }
    ],
    "parties": [
      "Česká pirátská strana"
    ],
    "institutions": [
      "Poslanecká sněmovna",
      "Ministerstvo pro místní rozvoj"
    ]
  },
  "highlights": [
    {
      "text": "Až 70 % úředníků hrozí, že skončí v souvislosti s novelou, což povede na místo zrychlení zcela zjevně ke zpomalení stavebního řízení.",
      "type": "paraphrase",
      "speaker": "Zdeněk Hřib",
      "affiliation": "Piráti",
      "timestamp": "1/00:00",
      "screenshot_path": "summaries/screenshots/event_2862_highlight_00.jpg",
      "context": "Tvrzení o 70 % úředníků je spekulativní odhad, který není podložen oficiální analýzou dopadů (RIA) k novele stavebního zákona. Reálný dopad na personální kapacity úřadů závisí na konkrétní implementaci digitalizace a přechodných ustanoveních zákona č. 283/2021 Sb."
    },
    {
      "text": "Novela zákona dává na stejnou úroveň mimo jiné ochranu zdraví obyvatel jako soukromé podnikání, nikdo nebude muset řešit hluk a kvalitu života.",
      "type": "citation",
      "speaker": "Veronika Kovářová",
      "affiliation": "Piráti",
      "timestamp": "1/04:45",
      "screenshot_path": "summaries/screenshots/event_2862_highlight_01.jpg",
      "context": "Jde o interpretaci priorit v rámci povolovacího procesu. Stavební zákon č. 283/2021 Sb. sice klade důraz na zrychlení řízení, ale ochrana veřejných zájmů (včetně hygienických limitů hluku) zůstává zakotvena v zákoně o ochraně veřejného zdraví č. 258/2000 Sb., který novela neruší."
    },
    {
      "text": "Chceme zvýšit limity pro vstup do systému podpory, aby o pomoc mohli žádat i ti, kteří normálně pracují, ale nezvládají rostoucí nájmy.",
      "type": "citation",
      "speaker": "Olga Richtrová",
      "affiliation": "Piráti",
      "timestamp": "1/08:45",
      "screenshot_path": "summaries/screenshots/event_2862_highlight_02.jpg",
      "context": "Jedná se o politický záměr v oblasti sociální politiky. Úprava limitů pro dávky na bydlení (příspěvek na bydlení) spadá pod zákon č. 117/1995 Sb., o státní sociální podpoře, a je předmětem probíhajících legislativních debat o adresnosti sociální pomoci."
    }
  ],
  "controversial": [
    {
      "statement": "Zdeněk Hřib obvinil ministryni Zuzanu Mrázovou z toho, že má „černou stavbu na pozemku u lesa“ a že v minulosti zneužívala systém startovacích bytů pro vlastní potřebu.",
      "speaker": "Zdeněk Hřib",
      "affiliation": "Piráti",
      "timestamp": "1/02:04",
      "screenshot_path": "summaries/screenshots/event_2862_controversy_00.jpg",
      "context": "Nelze nezávisle ověřit. Jde o osobní obvinění, které nebylo v rámci veřejně dostupných rejstříků či soudních rozhodnutí potvrzeno jako fakt; vyžaduje doložení konkrétními důkazy ze strany mluvčího."
    }
  ],
  "quality": {
    "transcript_quality": "partial",
    "unintelligible_parts": true
  },
  "extras": null
}