{
  "schema_version": "2",
  "created_at": "2026-05-29T05:06:39",
  "model_hint": "gemini-3.1-flash-lite",
  "event": {
    "id": "2855",
    "name": "15. schůze Rozpočtového výboru",
    "classification": "Jednání výborů",
    "start_date": "2026-04-29T09:05",
    "end_date": "2026-04-29T12:02",
    "sources": [
      "final/event_2855_2026-04-29_15-schuze-rozpoctoveho-vyboru.md"
    ]
  },
  "transcription": {
    "parts_transcribed": 19,
    "parts_total": 19,
    "source": "whisper",
    "model": "whisper-large-v3"
  },
  "summary": {
    "topic": "Jednání Rozpočtového výboru se zaměřilo na projednávání vládních návrhů zákonů v rámci přípravy na druhé čtení v Poslanecké sněmovně, kontrolu plnění státního rozpočtu a projednání výroční zprávy Evropského účetního dvora. Cílem bylo posoudit legislativní návrhy týkající se finančních služeb, investičních fondů, penzijního spoření a účetnictví, a zároveň zajistit transparentní dohled nad hospodařením státu a evropských fondů.",
    "main_points": [
      "**Jiří Palán (Ministerstvo financí)** — Prezentoval vládní návrhy zákonů (transpozice směrnic EU o finančních službách na dálku, spotřebitelský úvěr, zákon o účetnictví). Argumentoval nutností transpozice směrnic a snahou o minimalizaci „gold platingu“. Upozornil na rostoucí státní dluh (3 678 mld. Kč v roce 2025), přesto zdůraznil vysoké ratingové hodnocení ČR.",
      "**Vojtěch Munzar (poslanec)** — Kritizoval striktní nesouhlasné stanovisko MF k pozměňovacímu návrhu ohledně „tlačítka pro odstoupení od smlouvy“. Vyjádřil obavy z dopadů cenových stropů u spotřebitelských úvěrů na dostupnost legálních úvěrů pro rizikové klienty.",
      "**Jan Gregor (člen Evropského účetního dvora)** — Představil výroční zprávu auditorů EU za rok 2024. Upozornil na vysokou chybovost výdajů a rizika spojená s novými mechanismy financování EU. Varoval před budoucím zatížením rozpočtu EU splácením dluhu z nástroje pro oživení (cca 149 mld. EUR).",
      "**Miroslav Ševčík (poslanec)** — Kriticky se vyjádřil k hospodaření EU, označil ji za „plánovací komisi“ a varoval před skrytým deficitem rozpočtu EU.",
      "**Věra Kovářová (poslankyně)** — Reagovala na debatu o zadlužení státu, bránila konsolidační úsilí minulé vlády a zdůraznila význam poměru deficitu k HDP.",
      "**Patrik Nacher (poslanec)** — Podpořil kompromisní nastavení cenových stropů u spotřebitelských úvěrů (48 % RPSN) a upozornil na rizika spojená s regulací úvěrů s nulovým navýšením.",
      "**Bohumil Brásdil (poslanec)** — Otevřel téma „práva být zapomenut“ u onkologických pacientů při pojištění úvěrů, navrhl zkrácení lhůty z 15 let na 5–7 let."
    ],
    "outcome": "Výbor přijal usnesení k projednávaným tiskům, doporučil je k dalšímu čtení a stanovil lhůty pro podávání pozměňovacích návrhů. U zákona o spotřebitelském úvěru bylo projednávání přerušeno do 13. května 2026. U zákonů o účetnictví bylo projednávání přerušeno do září 2026.",
    "notes": "Přepis obsahuje četné technické chyby, opakující se fráze („Představující se výboru“, „Výbor výboru je výborný“) a místy nesrozumitelné pasáže způsobené automatickým přepisem."
  },
  "entities": {
    "speakers": [
      {
        "name": "Jiří Palán",
        "person_id": null,
        "affiliation": "Ministerstvo financí"
      },
      {
        "name": "Vojtěch Munzar",
        "person_id": "psp:person:6486",
        "affiliation": "Poslanec"
      },
      {
        "name": "Jan Gregor",
        "person_id": "psp:person:1350",
        "affiliation": "Evropský účetní dvůr"
      },
      {
        "name": "Miroslav Ševčík",
        "person_id": "psp:person:6064",
        "affiliation": "Poslanec"
      },
      {
        "name": "Věra Kovářová",
        "person_id": "psp:person:6214",
        "affiliation": "Poslankyně"
      },
      {
        "name": "Patrik Nacher",
        "person_id": "psp:person:6487",
        "affiliation": "Poslanec"
      },
      {
        "name": "Bohumil Brásdil",
        "person_id": null,
        "affiliation": "Poslanec"
      }
    ],
    "parties": [
      "ANO",
      "ODS",
      "STAN",
      "TOP 09"
    ],
    "institutions": [
      "Rozpočtový výbor",
      "Ministerstvo financí",
      "Evropský účetní dvůr"
    ]
  },
  "highlights": [
    {
      "text": "Hospodaření státního rozpočtu skončilo ke dni 30. 9. schodkem ve výši 153,9 miliard korun, což představuje zhruba 63,8 % plánovaného ročního deficitu.",
      "type": "paraphrase",
      "speaker": "Jana Mračková Vildumetzová",
      "affiliation": "ANO",
      "timestamp": "6/00:40",
      "screenshot_path": "https://f003.backblazeb2.com/file/cz-psp-videoarchive/screenshots/event_2855_highlight_00.jpg",
      "context": "Údaj odpovídá datům Ministerstva financí ČR o plnění státního rozpočtu ke konci září 2024. Schodek 153,9 mld. Kč skutečně odpovídal přibližně 63,8 % schváleného deficitu pro rok 2024 (252 mld. Kč)."
    },
    {
      "text": "Evropský účetní dvůr v podstatě plní roli jakéhosi evropského NKÚ, s tím, že máme silnější roli v tom ročním rozpočtovém procesu.",
      "type": "citation",
      "speaker": "Jan Gregor",
      "affiliation": "Evropský účetní dvůr",
      "timestamp": "7/01:19",
      "screenshot_path": "https://f003.backblazeb2.com/file/cz-psp-videoarchive/screenshots/event_2855_highlight_01.jpg",
      "context": "Evropský účetní dvůr (EÚD) skutečně provádí audit příjmů a výdajů EU, čímž plní obdobnou roli jako národní kontrolní úřady. Role EÚD v rozpočtovém procesu je však primárně kontrolní a poradní, nikoliv rozhodovací o výši rozpočtu."
    },
    {
      "text": "V roce 2025 deficit státního rozpočtu činil 291 miliard korun, což představovalo meziroční prohloubení schodku o 19 miliard korun.",
      "type": "paraphrase",
      "speaker": "Jiří Palán",
      "affiliation": "Ministerstvo financí",
      "timestamp": "6/04:43",
      "screenshot_path": "https://f003.backblazeb2.com/file/cz-psp-videoarchive/screenshots/event_2855_highlight_02.jpg",
      "context": "Tvrzení je fakticky nesprávné. Rok 2025 ještě neproběhl a návrh rozpočtu na rok 2025 počítá se schodkem 241 miliard korun, nikoliv 291 miliard."
    }
  ],
  "controversial": [
    {
      "statement": "Spor o výši stropu u spotřebitelských úvěrů (48 % RPSN) a jeho dopad na vytlačení klientů k lichvářům.",
      "speaker": "Vojtěch Munzar vs. Ministerstvo financí a Patrik Nacher",
      "affiliation": null,
      "timestamp": "12/02:05",
      "screenshot_path": "https://f003.backblazeb2.com/file/cz-psp-videoarchive/screenshots/event_2855_controversy_00.jpg",
      "context": "Debata se týká novely zákona o spotřebitelském úvěru. Argument o 'vytlačení k lichvářům' je častým politickým argumentem odpůrců přísné regulace RPSN, avšak jeho reálný dopad na trh je předmětem odborných sporů mezi ekonomy a regulátory."
    },
    {
      "statement": "Slovní přestřelka o odpovědnosti za zadlužení státu a smyslu členství v EU.",
      "speaker": "Miroslav Ševčík vs. Jan Jakob a Věra Kovářová",
      "affiliation": null,
      "timestamp": "9/02:08",
      "screenshot_path": "https://f003.backblazeb2.com/file/cz-psp-videoarchive/screenshots/event_2855_controversy_01.jpg",
      "context": "Nelze nezávisle ověřit. Jde o politickou polemiku o interpretaci ekonomických dat a politické orientaci státu, nikoliv o ověřitelné faktické tvrzení."
    }
  ],
  "quality": {
    "transcript_quality": "partial",
    "unintelligible_parts": true
  },
  "extras": null
}