{
  "schema_version": "2",
  "created_at": "2026-05-29T14:17:49",
  "model_hint": "gemini-3.1-flash-lite",
  "event": {
    "id": "2770",
    "name": "Tisková konference poslaneckého klubu ODS",
    "classification": "Tiskové konference",
    "start_date": "2026-03-23T15:35",
    "end_date": "2026-03-23T15:44",
    "sources": [
      "final/event_2770_2026-03-23_tiskova-konference-poslaneckeho-klubu-ods.md"
    ]
  },
  "transcription": {
    "parts_transcribed": 1,
    "parts_total": 1,
    "source": "captions",
    "model": null
  },
  "summary": {
    "topic": "Tisková konference poslaneckého klubu ODS byla svolána za účelem vyjádření postoje strany k aktuálním vládním krokům a bezpečnostní situaci v zemi. Hlavními tématy byla kritika vládního návrhu financování veřejnoprávních médií, reakce na bezpečnostní incident v Pardubicích a představení legislativního návrhu na zrušení zákazu prodeje ve vybraných státních svátcích.\n\nCílem konference bylo upozornit na podle ODS nekoncepční a populistické kroky vlády, kritizovat nedostatečné financování bezpečnostních složek a zdůraznit potřebu návratu ke standardním legislativním procesům.",
    "main_points": [
      "**Lucie Bartošová (ODS)** — Kritizovala vládní návrh na změnu financování veřejnoprávních médií (ČT a ČRo) jako chaotický a nekoncepční. Upozornila, že návrh obchází standardní legislativní proces. Varovala před finančními dopady: odhaduje ztrátu příjmů pro média ve výši cca 2,7 miliardy korun (cca čtvrtina rozpočtu).",
      "**Jan Lipavský (ODS)** — Reagoval na žhářský útok v Pardubicích; označil jej za teroristický akt a varoval před podceňováním bezpečnosti. Kritizoval škrty v rozpočtech bezpečnostních složek (BIS -300 mil. Kč, NÚKIB -100 mil. Kč, NBÚ -20 mil. Kč). Odsoudil komunikaci premiéra vůči firmám a vyzval vládu k zavedení vízové povinnosti pro ruské diplomaty.",
      "**Jan Bureš (ODS)** — Oznámil předložení novely zákona, která ruší zákaz otevírání obchodních center ve vybraných státních svátcích. Argumentoval, že stát nemá určovat podnikatelům otevírací dobu a že stávající zákon z roku 2016 vytváří chaos."
    ],
    "outcome": "Jednání bylo tiskovou konferencí, nikoliv hlasováním. ODS deklarovala, že na plénu Sněmovny nebude mlčet k vládním návrhům a bude prosazovat standardní legislativní postupy. Strana je připravena konstruktivně podpořit vládní kroky v oblasti bezpečnosti, pokud s nimi vláda přijde, avšak kritizuje dosavadní nečinnost a škrty v rozpočtech bezpečnostních institucí.",
    "notes": null
  },
  "entities": {
    "speakers": [
      {
        "name": "Lucie Bartošová",
        "person_id": "psp:person:6989",
        "affiliation": "ODS"
      },
      {
        "name": "Jan Lipavský",
        "person_id": "psp:person:6537",
        "affiliation": "ODS"
      },
      {
        "name": "Jan Bureš",
        "person_id": "psp:person:5899",
        "affiliation": "ODS"
      }
    ],
    "parties": [
      "ODS"
    ],
    "institutions": [
      "Česká televize",
      "Český rozhlas",
      "BIS",
      "NÚKIB",
      "Národní bezpečnostní úřad",
      "Poslanecká sněmovna"
    ]
  },
  "highlights": [
    {
      "text": "Podle našich odhadů můžou přijít obě média zhruba o 2,7 miliardy korun, což je zhruba čtvrtina celého rozpočtu.",
      "type": "paraphrase",
      "speaker": "Lucie Bartošová",
      "affiliation": "ODS",
      "timestamp": "1/01:44",
      "screenshot_path": "summaries/screenshots/event_2770_highlight_00.jpg",
      "context": "Výrok se pravděpodobně vztahuje k debatě o financování veřejnoprávních médií (ČT a ČRo). Celkový rozpočet obou institucí se pohybuje v řádech miliard korun, nicméně přesná částka 2,7 miliardy jako „čtvrtina“ závisí na konkrétním výpočtu zahrnujícím inflační doložky a legislativní změny v koncesionářských poplatcích."
    },
    {
      "text": "BIS přišla o 300 milionů korun, přitom je to právě vnitřní kontrarozvědka BIS, která sehrává stěžejní roli ve vyšetřování události v Pardubicích.",
      "type": "citation",
      "speaker": "Jan Lipavský",
      "affiliation": "ODS",
      "timestamp": "1/03:59",
      "screenshot_path": "summaries/screenshots/event_2770_highlight_01.jpg",
      "context": "Rozpočet BIS je součástí kapitoly státního rozpočtu pro Úřad vlády ČR a podléhá utajení. Tvrzení o krácení o 300 milionů korun nelze z veřejných zdrojů nezávisle ověřit, stejně tak jako konkrétní podíl BIS na vyšetřování incidentu v Pardubicích, které je vedeno orgány činnými v trestním řízení."
    },
    {
      "text": "Věc, kdy stát určuje obchodníkům, kdy mají mít otevřeno a kdy mají mít zavřeno, prostě nepatří do 21. století.",
      "type": "citation",
      "speaker": "Jan Bureš",
      "affiliation": "ODS",
      "timestamp": "1/08:27",
      "screenshot_path": "summaries/screenshots/event_2770_highlight_02.jpg",
      "context": "Jde o politický názor na regulaci trhu. V ČR platí zákon č. 223/2016 Sb., o prodejní době v maloobchodě, který omezuje prodej ve vybrané svátky; debata o jeho zrušení je dlouhodobým tématem, nikoliv faktickým sporem o existenci zákona."
    }
  ],
  "controversial": [
    {
      "statement": "**Kdo:** Jan Lipavský (ODS)\n**Co:** Označil žhářský útok v Pardubicích za „teroristický útok“ a kritizoval premiéra za to, že „začal osočovat ty firmy, že něco podcenily“.\n**Proč:** Označení útoku za teroristický je politicky citlivé z hlediska mezinárodních vztahů a vyšetřování, kritika premiéra přímo útočí na vládní krizovou komunikaci.\n**Čas:** 1/04:45",
      "speaker": "Jan Lipavský",
      "affiliation": "ODS",
      "timestamp": "1/04:45",
      "screenshot_path": "summaries/screenshots/event_2770_controversy_00.jpg",
      "context": "Právní kvalifikace útoku v Pardubicích jako „teroristický“ je v kompetenci orgánů činných v trestním řízení (Policie ČR, státní zastupitelství), nikoliv politiků. Označení za teroristický útok je politickou interpretací události, nikoliv potvrzeným právním stavem."
    }
  ],
  "quality": {
    "transcript_quality": "good",
    "unintelligible_parts": false
  },
  "extras": null
}