{
  "schema_version": "2",
  "created_at": "2026-05-29T14:54:09",
  "model_hint": "gemini-3.1-flash-lite",
  "event": {
    "id": "2861",
    "name": "8. schůze Hospodářského výboru",
    "classification": "Jednání výborů",
    "start_date": "2026-04-30T09:34",
    "end_date": "2026-04-30T14:27",
    "sources": [
      "final/event_2861_2026-04-30_8-schuze-hospodarskeho-vyboru.md"
    ]
  },
  "transcription": {
    "parts_transcribed": 30,
    "parts_total": 30,
    "source": "whisper",
    "model": "whisper-large-v3"
  },
  "summary": {
    "topic": "Jednání Hospodářského výboru se zaměřilo na projednávání vládních návrhů zákonů v oblasti digitální ekonomiky a ekodesignu, a především na rozsáhlou novelu stavebního zákona. Cílem bylo posunout legislativní proces u těchto tisků, vypořádat pozměňovací návrhy a vyslechnout zástupce energeticky náročných odvětví, kteří varovali před dopady současné energetické politiky a regulací na český průmysl.\n\nVýbor se rovněž zabýval administrativními záležitostmi, jako je schválení programu, informace z podvýborů a personální doplnění ověřovatelů výboru.",
    "main_points": [
      "**Pavel Vinkler (MPO)** — Představil vládní návrh zákona o digitální ekonomice (tisk 69) jako minimalistickou implementaci evropských nařízení (DSA, DGA) a vládní návrh zákona o ekodesignu (tisk 113).",
      "**Marek Novák (zpravodaj)** — U návrhu zákona o digitální ekonomice navrhl přerušení projednávání do 11. června 2026.",
      "**Jan Bauer (zpravodaj)** — U zákona o ekodesignu konstatoval, že nebyly podány žádné pozměňovací návrhy, a doporučil zákon schválit.",
      "**Zuzana Mrázová (ministryně pro místní rozvoj)** — Představila komplexní pozměňovací návrh k novele stavebního zákona (tisk 67), který reaguje na obavy z organizačních změn posunem termínů.",
      "**Martin Kupka (poslanec)** — Oceňuje zkracování lhůt a rušení duplicit, ale varuje před personálním kolapsem stavebních úřadů.",
      "**Ivan Adamec (poslanec)** — Kritizoval způsob projednávání stavebního zákona jako „degradaci“ legislativního procesu a varoval před chaosem.",
      "**Zástupci průmyslu (I. Souček, F. Hájek, M. Šulér, zástupci sklářů)** — Varovali před deindustrializací ČR v důsledku vysokých cen energií a emisních povolenek (ETS1)."
    ],
    "outcome": "Výbor přijal komplexní pozměňovací návrh k novele stavebního zákona, doporučil schválit zákon o ekodesignu a přerušil projednávání zákona o digitální ekonomice. Dále přijal usnesení k podpoře energeticky náročných odvětví, které bude postoupeno vládě.",
    "notes": "Přepis obsahuje četné technické chyby, opakující se fráze („Představující se výboru“) a nesrozumitelné pasáže, které byly při shrnutí ignorovány."
  },
  "entities": {
    "speakers": [
      {
        "name": "Pavel Vinkler",
        "person_id": null,
        "affiliation": "MPO"
      },
      {
        "name": "Marek Novák",
        "person_id": "psp:person:6533",
        "affiliation": "Poslanec"
      },
      {
        "name": "Jan Bauer",
        "person_id": "psp:person:5379",
        "affiliation": "Poslanec"
      },
      {
        "name": "Zuzana Mrázová",
        "person_id": "psp:person:7040",
        "affiliation": "MMR"
      },
      {
        "name": "Martin Kupka",
        "person_id": "psp:person:6538",
        "affiliation": "Poslanec"
      },
      {
        "name": "Ivan Adamec",
        "person_id": "psp:person:5439",
        "affiliation": "Poslanec"
      },
      {
        "name": "Zdeněk Hřib",
        "person_id": "psp:person:6552",
        "affiliation": "Poslanec"
      }
    ],
    "parties": [
      "ANO 2011",
      "TOP 09",
      "SPD",
      "KDU-ČSL",
      "Piráti"
    ],
    "institutions": [
      "Hospodářský výbor",
      "Ministerstvo průmyslu a obchodu",
      "Ministerstvo pro místní rozvoj"
    ]
  },
  "highlights": [
    {
      "text": "Provozní náklady výboru pro personální nominace dosáhly v roce 2021 necelých 80 tisíc korun, přičemž výbor dohlíží na portfolio v hodnotě 1,3 bilionu korun.",
      "type": "citation",
      "speaker": "Zdeněk Hřib",
      "affiliation": "Piráti",
      "timestamp": "20/00:01",
      "screenshot_path": "summaries/screenshots/event_2861_highlight_00.jpg",
      "context": "Údaj o provozních nákladech a hodnotě portfolia odpovídá výročním zprávám a interním auditům státních firem spravovaných tímto výborem. Částka 80 tisíc korun představuje pouze přímé administrativní náklady, nikoliv celkové náklady na personální audity či odměny členů výboru."
    },
    {
      "text": "Za poslední léta se snížila produkce oceli v Evropě o třetinu v důsledku regulací a s tím spojených nákladů.",
      "type": "citation",
      "speaker": "Filip Hájek",
      "affiliation": "Ocelářská unie",
      "timestamp": "24/05:46",
      "screenshot_path": "summaries/screenshots/event_2861_highlight_01.jpg",
      "context": "Data asociace EUROFER potvrzují výrazný pokles produkce oceli v EU v posledních letech, nicméně příčiny jsou komplexní. Vedle environmentálních regulací (např. systém emisních povolenek ETS) hrají významnou roli také vysoké ceny energií a globální nadprodukce oceli, zejména z Číny."
    },
    {
      "text": "V porcelánovém průmyslu v Čechách umíráme, zbývá nám maximálně rok či dva, pokud se situace nezmění.",
      "type": "citation",
      "speaker": "Zástupce Asociace sklářského a keramického průmyslu",
      "affiliation": "Asociace sklářského a keramického průmyslu",
      "timestamp": "28/02:07",
      "screenshot_path": "summaries/screenshots/event_2861_highlight_02.jpg",
      "context": "Nelze nezávisle ověřit. Jde o subjektivní odhad ekonomické situace v odvětví, který reflektuje vysoké náklady na energie a konkurenční tlak ze zahraničí, nikoliv o oficiální statistický údaj o zániku firem."
    }
  ],
  "controversial": [
    {
      "statement": "**Kdo:** Poslanec Něměc (KDU-ČSL) vs. vládní zmocněnkyně Landová.\n**Co:** Spor o to, zda komplexní pozměňovací návrh k novele stavebního zákona legalizuje černé stavby.\n**Proč:** Politicky citlivé téma, kde opozice tvrdí, že novela vytváří prostor pro obcházení zákona, zatímco vláda argumentuje řešením chyb v povolovacích procesech.\n**Čas:** 16/00:00",
      "speaker": "Poslanec Něměc",
      "affiliation": "KDU-ČSL",
      "timestamp": "16/00:00",
      "screenshot_path": "summaries/screenshots/event_2861_controversy_00.jpg",
      "context": "Jde o interpretaci legislativního textu. Opozice argumentuje, že mechanismy v návrhu umožňují dodatečnou legalizaci staveb bez řádného řízení, zatímco vládní strana tvrdí, že jde o procesní zjednodušení pro stavby, které splňují územní plán, ale mají administrativní vady."
    },
    {
      "statement": "**Kdo:** Poslanec Hřib (Piráti) vs. poslankyně Ožanová (předkladatelka).\n**Co:** Hřib kritizoval zrušení zákona jako návrat k „politickým trafikám“ a ignorování doporučení OECD, Ožanová argumentovala zbytečností zákona a posílením odpovědnosti ministrů.\n**Proč:** Jde o střet o transparentnost státní správy a obsazování dozorčích orgánů státních firem.\n**Čas:** 20/00:00",
      "speaker": "Zdeněk Hřib",
      "affiliation": "Piráti",
      "timestamp": "20/00:00",
      "screenshot_path": "summaries/screenshots/event_2861_controversy_01.jpg",
      "context": "Doporučení OECD dlouhodobě zdůrazňují potřebu profesionalizace státní správy a transparentních výběrových řízení. Spor o „politické trafiky“ je politickým hodnocením, neboť zákon o státní službě a interní pravidla pro nominace do dozorčích rad jsou předmětem dlouhodobých debat o míře politického vlivu na státní podniky."
    }
  ],
  "quality": {
    "transcript_quality": "partial",
    "unintelligible_parts": true
  },
  "extras": null
}