{
  "schema_version": "2",
  "created_at": "2026-05-29T15:37:30",
  "model_hint": "gemini-3.1-flash-lite",
  "event": {
    "id": "2850",
    "name": "Den jako poslanec",
    "classification": "Ostatní",
    "start_date": "2026-04-27T09:05",
    "end_date": "2026-04-27T14:54",
    "sources": [
      "final/event_2850_2026-04-27_den-jako-poslanec.md"
    ]
  },
  "transcription": {
    "parts_transcribed": 36,
    "parts_total": 36,
    "source": "mixed",
    "model": "whisper-large-v3"
  },
  "summary": {
    "topic": "Jednání 18. schůze Žákovské a studentské poslanecké sněmovny se konalo 27. dubna 2026 v prostorách Poslanecké sněmovny Parlamentu ČR. Hlavním tématem byla „Příprava na krizové situace“, konkrétně projednávání fiktivního návrhu zákona o obnově povinné vojenské služby a branné přípravě žáků středních škol.\n\nCílem akce bylo umožnit studentům vyzkoušet si legislativní proces, prezentační dovednosti a kritickou diskuzi o společensky citlivém tématu. Studenti vystupovali v rolích poslanců, zatímco skuteční politici zastávali role ministrů a poskytovali odbornou i procedurální zpětnou vazbu.",
    "main_points": [
      "**Ondřej Matěj Havel (ministr)** — Zdůraznil, že bezpečnost je základní funkcí státu a aktuálnost obranné politiky v Evropě.",
      "**Pekař (host, Univerzita obrany)** — Argumentoval, že armáda má fungovat jako prevence a vojenská služba by měla být založena na dobrovolnosti a kompetencích.",
      "**Marek Výborný (ministr)** — Přiblížil historické souvislosti sálu a pravidla jednacího řádu.",
      "**Robert Králíček (ministr)** — Varoval před poddimenzovaností bezpečnostních složek a rizikem odlivu personálu od policie a hasičů.",
      "**Jan Berky (ministr)** — Vysvětlil legislativní proces a nutnost souladu zákona se školským zákonem a ústavou.",
      "**Studentské kluby** — Předložily řadu pozměňovacích návrhů, od zkrácení délky služby (na 2–3 měsíce) až po zrušení povinnosti letních kurzů či zavedení výjimek pro sportovce a studenty."
    ],
    "outcome": "Po rozsáhlé rozpravě a hlasování o pozměňovacích návrzích byl zákon jako celek **neschválen**. Předsedající konstatoval, že se tak stalo teprve podruhé v historii těchto konferencí.",
    "notes": "Přepis obsahuje technické artefakty (useknutá slova, opakující se fráze), které byly pro účely shrnutí ignorovány. Části záznamu byly nesrozumitelné."
  },
  "entities": {
    "speakers": [
      {
        "name": "Ondřej Matěj Havel",
        "person_id": null,
        "affiliation": "ministr"
      },
      {
        "name": "Pekař",
        "person_id": "psp:person:3177",
        "affiliation": "Univerzita obrany"
      },
      {
        "name": "Marek Výborný",
        "person_id": "psp:person:6513",
        "affiliation": "ministr"
      },
      {
        "name": "Robert Králíček",
        "person_id": "psp:person:6509",
        "affiliation": "ministr"
      },
      {
        "name": "Jan Berky",
        "person_id": "psp:person:6722",
        "affiliation": "ministr"
      },
      {
        "name": "Miroslav Krejčí",
        "person_id": "psp:person:7016",
        "affiliation": "ministr"
      }
    ],
    "parties": [
      "KDU-ČSL",
      "Piráti",
      "Motoristé"
    ],
    "institutions": [
      "Poslanecká sněmovna",
      "Univerzita obrany"
    ]
  },
  "highlights": [
    {
      "text": "Země, která není ochotna se bránit, si nezaslouží svobodu.",
      "type": "citation",
      "speaker": "Marek Benda",
      "affiliation": "předseda vlády (fiktivní)",
      "timestamp": "7/06:59",
      "screenshot_path": "summaries/screenshots/event_2850_highlight_00.jpg",
      "context": "Jde o subjektivní politický názor a hodnotový soud, který nelze fakticky ověřit. Výrok reflektuje klasickou politickou filozofii (např. myšlenky Machiavelliho či Clausewitze) o nutnosti vlastní obranyschopnosti státu."
    },
    {
      "text": "Bezpečnost nelze outsourcovat. Stejně jako žádnou jinou zodpovědnost.",
      "type": "citation",
      "speaker": "Pekař",
      "affiliation": "Univerzita obrany",
      "timestamp": "3/05:12",
      "screenshot_path": "summaries/screenshots/event_2850_highlight_01.jpg",
      "context": "Jde o politicko-filozofické tvrzení o suverenitě státu. Z hlediska mezinárodního práva a kolektivní obrany (např. čl. 5 Smlouvy o NATO) je bezpečnost sdílenou odpovědností, nikoliv čistě vnitřní záležitostí státu."
    },
    {
      "text": "Politika je týmový sport, ale pro vrcholové sportovce.",
      "type": "citation",
      "speaker": "Jan Berky",
      "affiliation": "ministr",
      "timestamp": "31/08:59",
      "screenshot_path": "summaries/screenshots/event_2850_highlight_02.jpg",
      "context": "Metafora bez faktického obsahu. Nelze ověřit, jde o subjektivní hodnocení nároků na výkon politické funkce."
    }
  ],
  "controversial": [
    {
      "statement": "Návrh na zrušení letních prázdnin pro žáky, kteří neabsolvují branný kurz.",
      "speaker": "Miroslav Krejčí",
      "affiliation": "ministr",
      "timestamp": "18/06:04",
      "screenshot_path": "summaries/screenshots/event_2850_controversy_00.jpg",
      "context": "V současné české legislativě (školský zákon č. 561/2004 Sb.) neexistuje právní rámec, který by umožňoval zrušení prázdnin jako sankci za neabsolvování branného kurzu. Návrh by vyžadoval zásadní legislativní změnu."
    },
    {
      "statement": "Srovnání ČR s autoritářskými režimy (Severní Korea, Írán) v kontextu povinné vojny.",
      "speaker": "Jáchym Král",
      "affiliation": "poslanec",
      "timestamp": "19/06:06",
      "screenshot_path": "summaries/screenshots/event_2850_controversy_01.jpg",
      "context": "Srovnání je zavádějící. Zatímco v KLDR je branná povinnost extrémně dlouhá a totalitně vynucovaná, v ČR je branná povinnost zakotvena v Ústavě a zákoně č. 585/2004 Sb. (branný zákon), ale v mírovém stavu není aktivována formou povinné základní vojenské služby."
    }
  ],
  "quality": {
    "transcript_quality": "partial",
    "unintelligible_parts": true
  },
  "extras": null
}