{
  "schema_version": "2",
  "created_at": "2026-05-29T15:10:39",
  "model_hint": "gemini-3.1-flash-lite",
  "event": {
    "id": "2903",
    "name": "Tisková konference poslaneckého klubu hnutí ANO",
    "classification": "Tiskové konference",
    "start_date": "2026-05-13T08:22",
    "end_date": "2026-05-13T08:39",
    "sources": [
      "final/event_2903_2026-05-13_tiskova-konference-poslaneckeho-klubu-hnuti-ano.md"
    ]
  },
  "transcription": {
    "parts_transcribed": 1,
    "parts_total": 1,
    "source": "captions",
    "model": null
  },
  "summary": {
    "topic": "Tisková konference se konala v průběhu mimořádné schůze Poslanecké sněmovny, na které hnutí ANO prosazuje novelu zákona o pravidlech rozpočtové odpovědnosti. Cílem je podle ministryně financí Aleny Schillerové napravit „bezprecedentní selhání“ předchozí vlády Petra Fialy, která se podle ní zavázala k nereálným fiskálním cílům (snížení deficitu na 150 mld. Kč v roce 2027 a 126 mld. Kč v roce 2028).\n\nHnutí ANO argumentuje, že stávající pravidla jsou v rozporu s realitou a jejich dodržení by vedlo k paralýze státu, omezení investic a ohrožení bezpečnosti. Navrhovaná úprava má zajistit věrohodnou konsolidaci veřejných financí při zachování deficitu pod hranicí 3 % HDP, aniž by došlo k recesi ekonomiky.",
    "main_points": [
      "**Alena Schillerová (ministryně financí)** — Kritizovala bývalou vládu za nereálné fiskální cíle a fiktivní rozpočtové plány. Představila pozměňovací návrhy jako pojistky: prodloužení výjimky pro výdaje na obranu (nad 2 % HDP) a liniové stavby do roku 2036. Odmítla, že by šlo o přílepky, a zdůraznila nutnost implementace evropských pravidel.",
      "**Pevné hlasování** — Možnost pevného hlasování v pátek nebyla vyloučena, závisí na rozhodnutí vedení sněmovny a koaličních klubů.",
      "**Jednání s EK** — Probíhají technická jednání s Evropskou komisí, čeká se na makroekonomickou predikci EK do konce května."
    ],
    "outcome": "Formální výsledek jednání nebyl oznámen, neboť tisková konference probíhala v průběhu legislativního procesu. Dominujícím postojem hnutí ANO je odhodlání zákon prosadit, a to i za cenu využití procedurálních nástrojů, přičemž jakoukoli případnou ústavní stížnost opozice hodlá vláda u Ústavního soudu aktivně obhajovat.",
    "notes": null
  },
  "entities": {
    "speakers": [
      {
        "name": "Alena Schillerová",
        "person_id": "psp:person:6545",
        "affiliation": "ANO"
      },
      {
        "name": "Daniela Habešová",
        "person_id": null,
        "affiliation": "CNN Prima NEWS"
      },
      {
        "name": "Daniela Brychtová",
        "person_id": null,
        "affiliation": "Český rozhlas"
      },
      {
        "name": "Petr Vašek",
        "person_id": "psp:person:4469",
        "affiliation": "Česká televize"
      }
    ],
    "parties": [
      "ANO",
      "ODS"
    ],
    "institutions": [
      "Poslanecká sněmovna",
      "Evropská komise",
      "Česká národní banka",
      "Národní rozpočtová rada",
      "Ústavní soud"
    ]
  },
  "highlights": [
    {
      "text": "Neexistuje realistický a odpovědný scénář, jak během jednoho roku snížit deficit o 150 miliard korun.",
      "type": "paraphrase",
      "speaker": "Alena Schillerová",
      "affiliation": "ANO",
      "timestamp": "1/05:12",
      "screenshot_path": "summaries/screenshots/event_2903_highlight_00.jpg",
      "context": "Toto tvrzení je subjektivním politickým názorem na rozpočtovou politiku. Možnost snížení deficitu závisí na konkrétních úsporných opatřeních (např. rušení daňových výjimek, omezení dotací) a makroekonomickém vývoji, což činí toto tvrzení neověřitelným faktem, ale legitimní politickou polemikou."
    },
    {
      "text": "My kamuflovat nic nebudeme.",
      "type": "citation",
      "speaker": "Alena Schillerová",
      "affiliation": "ANO",
      "timestamp": "1/08:55",
      "screenshot_path": "summaries/screenshots/event_2903_highlight_01.jpg",
      "context": "Jde o politickou deklaraci, kterou nelze fakticky ověřit. Hodnocení „kamuflování“ je subjektivní interpretací účetních a rozpočtových postupů dané politické strany."
    },
    {
      "text": "Znovu opakuji, neměníme parametry rozpočtové odpovědnosti, které jsme slíbili a deklarovali, nadále platí náš závazek držet deficit veřejných financí bezpečně pod hranicí 3 % HDP.",
      "type": "citation",
      "speaker": "Alena Schillerová",
      "affiliation": "ANO",
      "timestamp": "1/04:38",
      "screenshot_path": "summaries/screenshots/event_2903_highlight_02.jpg",
      "context": "Závazek držet deficit pod 3 % HDP vychází z pravidel Paktu stability a růstu EU. Aktuální data MF ČR a predikce ČNB ukazují, že dodržení tohoto limitu je závislé na konkrétních rozpočtových opatřeních a vývoji ekonomiky; v minulosti se cíle v oblasti deficitu často měnily v závislosti na vnějších šocích."
    }
  ],
  "controversial": [
    {
      "statement": "**Kontroverzní návrh:** Prodloužení výjimek z výdajových rámců (obrana a liniové stavby) do roku 2036.\n- **Kdo:** Alena Schillerová (ANO).\n- **Co:** Návrh vyjmout tyto investice z výdajových rámců a prodloužit platnost výjimek.\n- **Proč:** Opozice a Národní rozpočtová rada to interpretují jako obcházení rozpočtové odpovědnosti a „přílepky“, zatímco vláda to označuje za nezbytnou pojistku pro udržení investic.\n- **Čas:** 1/12:05",
      "speaker": "Alena Schillerová",
      "affiliation": "ANO",
      "timestamp": "1/12:05",
      "screenshot_path": "summaries/screenshots/event_2903_controversy_00.jpg",
      "context": "Výdajové rámce jsou definovány zákonem č. 23/2017 Sb., o pravidlech rozpočtové odpovědnosti. Návrhy na jejich úpravu či výjimky jsou předmětem legislativního procesu; Národní rozpočtová rada (NRR) pravidelně upozorňuje, že rozšiřování výjimek oslabuje transparentnost a závaznost fiskálních pravidel."
    }
  ],
  "quality": {
    "transcript_quality": "good",
    "unintelligible_parts": false
  },
  "extras": null
}